{
  "schema_version": "aoa_stats_owner_landing_summary_v1",
  "generated_from": {
    "receipt_input_paths": [
      "session_harvest_family.receipts.example.json"
    ],
    "total_receipts": 16,
    "latest_observed_at": "2026-04-06T09:45:00Z"
  },
  "owner_repo_counts": {
    "aoa-skills": 1
  },
  "owner_shape_counts": {
    "skill": 1
  },
  "status_posture_counts": {
    "early": 1
  },
  "landing_outcome_counts": {
    "landed_owner_status": 1
  },
  "time_to_outcome_median_days": {
    "landed_owner_status": 0.0,
    "landed_owner_object": null,
    "reanchored": null,
    "merged": null,
    "deferred": null,
    "dropped": null
  }
}
